dataHoraInicio,dataHoraFim,uriEvento,tipoDiscurso,urlTexto,urlAudio,urlVideo,keywords,sumario,transcricao,id,titulo,dataHoraInicio,dataHoraFim
2020-12-18T17:44,,,COMO LÍDER,http://imagem.camara.leg.br/dc_20b.asp?largura=&altura=&tipoForm=diarios&selCodColecaoCsv=D&Datain=19%2F12%2F2020&txPagina=199&txSuplemento=&enviar=Pesquisar,,,"CRÍTICA, DISCURSO PARLAMENTAR, OPOSIÇÃO POLÍTICA, ALESSANDRO MOLON, FERNANDA MELCHIONNA, DEPUTADO FEDERAL, USO DA PALAVRA, REGIMENTO INTERNO DA CÂMARA DOS DEPUTADOS, ENCERRAMENTO, SESSÃO DELIBERATIVA, BASE DE APOIO POLÍTICO, GOVERNO FEDERAL, ELEIÇÕES, MESA DIRETORA, REELEIÇÃO, PRESIDENTE DA CÂMARA DOS DEPUTADOS, INCONSTITUCIONALIDADE, SUPREMO TRIBUNAL FEDERAL (STF), DEFESA, PROPOSTA DE ACORDO, ARTHUR LIRA, LÍDER DO GOVERNO.
COLÉGIO DE LÍDERES, PRINCÍPIO DA PROPORCIONALIDADE, RELATOR, MPV 1003/2020, MEDIDA PROVISÓRIA, AUTORIZAÇÃO, PODER EXECUTIVO, ADESÃO, INSTRUMENTO DE ACESSO GLOBAL DE VACINAS COVID-19 (COVAX FACILITY), AQUISIÇÃO, VACINA, PANDEMIA, CORONAVÍRUS, CRÍTICA, PAUTA (PROCESSO LEGISLATIVO), SESSÃO DELIBERATIVA, CÂMARA DOS DEPUTADOS.","Contestação aos pronunciamentos proferidos pelos Deputados Alessandro Molon e Fernanda Melchionna contra o orador, por suposto descumprimento do Regimento Interno. Anúncio pelo PT de formação de bloco partidário, com vista às eleições da Mesa da Câmara dos Deputados. Cumprimento pelo Parlamentar de acordos celebrados no âmbito da Casa. Repúdio à ditadura de representatividade reinante na Câmara dos Deputados. Direito do Plenário de alteração de proposições. Falta de coerência dos partidos da Oposição.","O SR. ARTHUR LIRA (Bloco/PP - AL. Como Líder. Sem revisão do orador.) - Sr. Presidente, Sras. Deputadas, Srs. Deputados, mais cedo, eu me comprometi com o Deputado Alessandro Molon, por quem sempre tive muito respeito e admiração. Quando fui Presidente da CCJ, convivemos longamente, com muita independência, com muita altivez, com muita capacidade de diálogo, nesta Casa.
Agora, Deputada Fernanda Melchionna, nem V.Exa. nem o Deputado Alessandro Molon têm o direito de subir a qualquer tribuna para falar o meu nome e dizer que não cumpro o Regimento Interno nesta Casa. Se V.Exas. não estão acostumados a cumprir o Regimento, quero dizer que todas as vezes em que alguém do NOVO, como o Deputado Paulo Ganime, invoca o direito regimental de encerramento de sessão, porque não tem publicação de parecer, eu nunca fui à tribuna para dizer que ele é antidemocrático, que queria cercear a minha palavra, cortar o direito de uso da palavra de quem não o tinha, regimentalmente. 
Deputada, é bom ler o Regimento.
É interessante ler o Regimento. De quem esbraveja por esbravejar não tenho medo, nunca tive. Respeito muito V.Exa., como sempre o fiz.
E ao Deputado Alessandro Molon, que chega aqui com um discurso muito bonito, eu dizia: ""Veja de novo o seu discurso, reveja o seu discurso. Foi injusto com o seu amigo, com o seu companheiro que sempre o tratou com fidalguia"". 
Esta Casa nunca será por parte de ninguém puxadinho de canto nenhum. Sou da base do Governo, Deputada Fernanda Melchionna, nunca neguei isso, como são também o Deputado Baleia Rossi e o Deputado Aguinaldo Ribeiro, que é do meu partido. Vamos tirar essas cortinas, essa desfaçatez. 
Hoje o PT disse que vai fazer um bloco com dois candidatos da base do Governo, mas vai apresentar um terceiro nome. Agora a lista virou tríplice de novo, e nós vamos ficar nessa democracia de interesses que vão ao submundo do controle da Câmara dos Deputados. Sabe-se lá que interesses moveram para que houvesse essa composição democrática. E é normal que haja, Deputado Arnaldo. Respeitamos isso, nós só não respeitamos quando as pessoas vêm a esta tribuna para fazer juízo de valor, dizer coisas que não existem, reputar situações que não procedem. 
Eu sempre tive nesta Casa muita coerência, muito posicionamento, muito respeito pelos meus amigos, muita independência e, acima de tudo, palavra. Sempre cumpri, Deputada Melchionna, todos os meus compromissos nesta Casa. Nunca dei o direito de Deputado nenhum sair pelos corredores dizendo que enganei, que prometi alguma coisa e não entreguei, que fiz algum acordo e não cumpri. É isso o que me mantém vivo nesta Casa, gostem V.Exas. ou não. 
Não sei que tipo de partidos gostam de ouvir, de sentir e de saber aquela ladainha que envolve, que engana, que inibe o futuro democrático desta Casa. 
A caneta tem tinta. Quando se escreve muito com ela, ela seca, é normal. E quando não se quer desapegar, não se pode absolutamente falar, Deputado Alessandro Molon, em respeito, em independência, em defesa da Constituição, quando vários partidos nesta Casa não se posicionaram por manter a Constituição no que ela foi mais clara: é vedada a recondução de candidatos que tenham ocupado o mesmo cargo na legislatura - é vedada! O legislador originário vedou, e o Supremo Tribunal Federal teve que manter uma tentativa forçada de querer fazer uma reeleição com 6 votos naquela Casa. 
Muitos partidos não assinaram. Acho que o partido de V.Exa., Deputado Kim Kataguiri, não assinou aquele manifesto. O partido do Deputado Baleia Rossi não assinou o manifesto e vários outros partidos. E respeito isso. Não fui a canto nenhum, a tribuna nenhuma, a espaço público nenhum dizer que aquele partido é antidemocrático, que aquele partido é usurpador, que aquele partido é golpista, que aquele partido quer continuar no poder permanentemente. Nós não fizemos isso. 
É bom que se restabeleça o respeito neste plenário. E não é pelo fato de sermos da base do Governo, e todos somos, uns botam a carapuça na cabeça, outros não.
Respeito a Oposição original. Respeito, Deputada Melchionna, a sua posição. Respeite a dos outros.
Eu só pedi ali o cumprimento do Regimento. Nós não vamos criar dificuldades. Eu só pedi o cumprimento do Regimento - Deputado Kim, invoco o seu testemunho - e fiz uma proposição de acordo. O acordo não envolvia naquele momento fazer pronunciamentos políticos. Podia-se usar o tempo de Liderança, como fez normalmente o Deputado Orlando.
Não passarão as mentiras nesta Casa, porque, a partir de hoje, toda vez em que houver uma ilação, toda vez em que houver uma difamação, toda vez em que houver uma frase equivocada, nós vamos rebater!
Esta Casa precisa de voz. Esta Casa vive hoje uma ditadura de representatividade. Não há rodízio proporcional nos relatórios de medidas provisórias, de projetos de lei, de PECs. Quando o Relator é escolhido, como foi hoje o Relator da MP 1.003/20, que é do meu partido, o Líder nem fica sabendo, nem toma conhecimento. A matéria chegou no dia de hoje, e já queriam votá-la.
Não tem mais função, Deputado Arnaldo, o Colégio de Líderes nesta Casa. Não existe mais o princípio da proporcionalidade para entrega das matérias. Não existe mais a liberdade de os Relatores escolherem matérias, botá-las no seu texto e submeter o texto à vontade majoritária deste Plenário.
Este Plenário tem o direito de suprimir, de modificar, de alterar, de destacar, de aditar, de fazer o que quiser por maioria. Nós não estamos tendo esse direito e estávamos calados o tempo todo. Mas agora não mais. A desfaçatez tem que ser combatida também. Ela tem que ser combatida também e será!
Eu não sei qual é o objetivo da pauta de hoje. Agora, por certo, ela causou um tumulto grande no Brasil, com o dólar subindo, a Bolsa caindo. Para quê? Para chegarmos aqui e ficarmos nos debatendo para dizer: ""Não tem prazo regimental. Não tem parecer apresentado. Não pode ser votada hoje"". Não haveria essa discussão. Não havia necessidade disso.
Então, vamos colocar as coisas nos seus devidos lugares: respeito, prudência, limite, coerência, que é o que falta a muitos partidos da Oposição! Talvez falte também um comprimidozinho para memória. Talvez com a memória mais aguçada o façam. E muitos dos que assinaram hoje aí não têm maioria para ter feito anúncio de formação de bloco.
Muito obrigado, Presidente.",160541,Breves Comunicações,,
2021-02-01T20:40,,,OUTROS,http://imagem.camara.leg.br/dc_20b.asp?largura=&altura=&tipoForm=diarios&selCodColecaoCsv=D&Datain=2%2F2%2F2021&txPagina=32&txSuplemento=&enviar=Pesquisar,,,"ELEIÇÕES, MESA DIRETORA, CANDIDATO, PRESIDENTE DA CÂMARA DOS DEPUTADOS, PLENÁRIO DA CÂMARA DOS DEPUTADOS, ATUAÇÃO PARLAMENTAR, COLÉGIO DE LÍDERES, PAUTA (PROCESSO LEGISLATIVO), DEMOCRATIZAÇÃO, RELATOR, VOTAÇÃO, PRINCÍPIO DA PROPORCIONALIDADE PARTIDÁRIA, TRANSPARÊNCIA, PROPOSIÇÃO LEGISLATIVA, PROJETO DE LEI ORDINÁRIA, DIÁLOGO POLÍTICO, COOPERAÇÃO POLÍTICA, CAMPANHA ELEITORAL, ARTHUR LIRA, DEPUTADO FEDERAL.","Contrariedade à concentração de poderes pela Presidência da Casa em detrimento dos Parlamentares. Compromisso do orador, na condição de candidato ao cargo de Presidente da Casa, de fortalecimento das Comissões, do Plenário e instâncias colegiadas; de publicação antecipada da pauta de votações; de ouvir e dar voz aos Deputados; e de distribuição de proposições com isenção, observada à proporcionalidade partidária. Restabelecimento da soberania do Plenário, no caso da eleição do orador para a Presidência da Câmara dos Deputados. Agradecimento aos Parlamentares pelo apoiamento à campanha do orador à Presidência.","O SR. ARTHUR LIRA (Bloco/PP - AL. Sem revisão do orador.) - Sr. Presidente, membros da Mesa Diretora que fazem parte desta cerimônia, sentados ao lado da cadeira do Presidente, Vice-Presidente, Deputado Marcos Pereira, 1ª Secretária, Deputada Soraya Santos, Deputado André Fufuca -- não consigo ver daqui se o Deputado Expedito Netto está aqui também --, foram 51 milhões, 817 mil e 919 votos.
Neste plenário, neste momento, estamos aqui diante de representantes de mais de 51 milhões de brasileiros. Se os eleitores que votaram em V.Exas. formassem um país, as senhoras e os senhores representariam uma das 30 maiores nações do planeta. Se levarmos em conta os quase cem milhões de votos que foram dados a todos os candidatos e candidatas a Deputado e a Deputada Federal, eleitos, eleitas, não eleitos e não eleitas, o pleito que os trouxe até aqui, que lhes deu a sagrada representatividade de pertencer a este plenário, equivale a uma das doze ou treze nações mais populosas do mundo.
Tendo em vista a representatividade deste Plenário, que se fosse um país teria 51 milhões de pessoas, coloquei, desde o início, a questão fundamental de uma nova forma de funcionamento desta instituição: 51 milhões de votos não podem ser funcionários, não podem ser submissos, não podem ser subalternos da vontade de apenas um, da vontade de um só.
A Câmara tem que ser de todos. A Câmara não pode continuar sendo a Câmara do ""eu"". Isso eu preguei em todos os Estados da Federação que visitei, ao conversar com todas as bancadas desta Casa.(Palmas.)
A Câmara é do ""nós"". E isso não é um slogan de campanha nem uma frase de efeito. Isso é a alma desta Casa, o espírito do nosso Regimento, algo que está impregnado em todos os lugares.
Por favor, olhem para a cadeira da Presidência. Por acaso ali há um trono? Não! Ao lado do Presidente, há outras cadeiras para os demais representantes da Mesa Diretora. Tudo nesta Casa, como se vê, tem a marca do coletivo. O indivíduo não existe em relação à instituição, em respeito à colegialidade, que é a marca desta Casa, em respeito às dezenas de milhões de votos que V.Exas. representam. Por isso, temos que dar voz a todas as Deputadas e a todos os Deputados. Por isso, temos que retirar o superpoder da Presidência, como foi nos últimos anos, e devolver este superpoder para o seu único e legítimo dono: o Plenário da Câmara dos Deputados!(Palmas.)
Este plenário em que passei os últimos 10 anos da minha atividade parlamentar, em pé, no chão da fábrica, trabalhando pelo meu País, trabalhando ao lado dos Deputados do nosso partido nos mais diversos debates e assuntos, ali embaixo, naquele microfone. O Plenário, sim, é soberano e deve voltar a ser o Presidente da Câmara, o único, o legítimo Presidente da Câmara. 
A Maioria deve falar, a Minoria deve falar, a proporcionalidade deve falar, o Colégio de Líderes deve falar, cada Deputado deve ter voz. E ao Presidente não cabe falar, cabe ouvir, de forma neutra, nem a favor nem contra, sem personalismos. Menos ""eu"", mais ""nós"". Menos ""eu"", mais ""nós""! 
Não é à toa que, quando um Deputado ou Deputada atinge a posição mais destacada entre seus pares, a Presidência, nosso sábio Regimento definiu que a esse a quem cabe a missão de coordenar os trabalhos da Casa é imposta automaticamente a perda da mais fundamental prerrogativa parlamentar: a de votar. Isso quer dizer que o Presidente não pode ter posições pessoais. Se um Deputado ou Deputada quiser ter posições, que não seja Presidente, que fique no plenário, para expressá-las através de seu voto. A Presidência não pode falar pela Casa. A Casa é que deve falar inclusive através de seu Presidente. Quanto mais poderosa e influente a voz de cada Deputada e de cada Deputado, individualmente, mais poderosa se torna a voz da Câmara. Quanto mais a única voz audível é a de um só, a de seu Presidente, mais emudecido fica este Poder. Que esta Casa volte a falar através do ""nós"", sempre do ""nós""!
E não é só isso: democratizar e desconcentrar o poder da Presidência, fortalecer as instâncias dos Colégios, das Comissões, do Plenário, cria um ambiente de previsibilidade.
Eu pautei, em todas as conversas que tive, que haverá reunião dos partidos com seus Líderes e reunião dos Líderes com seu Presidente todas as quintas-feiras, à tarde, para termos uma pauta publicada,(Palmas.) com Relator definido, para que saibamos o que vamos votar na semana seguinte e saibamos quem é o Relator, o Relator que tenha o seu relatório com independência, com altivez, nesta Casa, sem sofrer retaliação nem censura, com o projeto pronto, para darmos a todos os setores da sociedade civil organizada tempo para discutir, para procurar os seus Parlamentares nos Estados e Municípios.
Transparência nessa pauta e absoluto respeito pela proporcionalidade partidária, Deputado Zarattini, do PT, a maior bancada, à REDE, a menor bancada!
Os projetos de lei, as medidas provisórias e as propostas de emenda à Constituição serão distribuídos nesta Casa com isenção, obedecendo-se à proporcionalidade partidária, resultado do voto dos 51 milhões de brasileiros que colocaram aqui Deputadas e Deputados.(Palmas.)
Temos de ter ritos. Quanto mais ritos, mais previsibilidade, menos surpresas, como a de hoje, menos solavancos, maiores as chances de acertarmos e menor a chance de errarmos, maior a transparência desta Casa.
Eu quero ser o Presidente desta Casa que não será o mais famoso entre todos os Deputados, que não será o que vai aparecer mais na televisão ou nas redes sociais, mas, se Deus assim quiser e com o apoio de V.Exas., meus amigos e minhas amigas, companheiros de vários anos - e quase todos conheço por nome: meu amigo Silas, minha amiga Zambelli, minha amiga Celina, meu amigo Tibé, Darci, Sidney Leite, meu amigo Jhonatan, Cacá Leão, Aroldo, Milton, dentre tantos outros, todos nós sabemos o que é relacionamento nesta Casa -, eu quero ser o Presidente que, ao restabelecer a soberania do Plenário, não mandou nem desmandou, mas terá coordenado um dos períodos mais produtivos de aprovação de leis, de tomada de decisões fundamentais num momento crucial na história do País e terá sido testemunha de que um plenário forte faz muito mais forte o legado de qualquer Presidente.
Acima de todas as diferenças, acima de todas as ideologias, de todas as diferenças ideológicas que compõem a pluralidade desta Casa, os de esquerda, os de direita e os de centro sempre tiveram em mim um Deputado de diálogo, de acordo, de conversas e de cumprimento de palavra, o que tem que voltar a funcionar no plenário desta Casa.(Palmas.)
Que na Câmara a união de todos possa, mais do que nunca, fazer a diferença na vida de todas as brasileiras e de todos os brasileiros.
Antes de encerrar, eu queria agradecer a todos os Deputados e Deputadas que se empenharam neste período eleitoral, à bancada feminina, às mulheres que coordenaram, lutaram, dialogaram e trabalharam pela minha campanha,(Palmas.)
uma campanha limpa, uma campanha sem ataques, uma campanha sem vídeos apócrifos, sem candidatos laranja, sem qualquer coisa de subterfúgio, sem golpes regimentais.
Nós queremos esta Câmara unida. O Brasil precisa de reformas, o Brasil precisa tocar as pautas. Qualquer assunto será tratado sem nenhum pingo de preconceito pela Presidência desta Casa. Precisa haver amadurecimento na população, maioria no Plenário e maioria no Colégio de Líderes. Ele virá para a pauta, e o Plenário decidirá.
Quero agradecer a todos os Estados pela receptividade que tivemos.
Quero dizer que eu acredito na consciência livre das mulheres e dos homens de bem desta Casa, para que possam expressar hoje, com força, a vontade de ver uma Câmara independente, sim, uma Câmara autônoma, mas uma Câmara harmônica. O Brasil não aguenta mais acotovelamentos, o Brasil não aguenta mais brigas, o Brasil não aguenta mais puxar cordas. Nós temos que fazer deste ano de 2021 um ano diferente e dar exemplos à Nação e ao povo, que está lá fora esperando respeito, pauta e reciprocidade.
Até a vitória, com a ajuda de todos, se Deus quiser!
Muito obrigado.",160541,Abertura,,
2021-02-03T11:28,,,FALA DO PRESIDENTE OU NO EXERCÍCIO DA PRESIDÊNCIA,http://imagem.camara.leg.br/dc_20b.asp?largura=&altura=&tipoForm=diarios&selCodColecaoCsv=D&Datain=4%2F2%2F2021&txPagina=22&txSuplemento=&enviar=Pesquisar,,,"QUESTÃO DE ORDEM, JÚLIO DELGADO, DEPUTADO FEDERAL, INDICAÇÃO, ISNALDO BULHÕES JR, DEPUTADO FEDERAL, MEMBRO, PARTIDO SOCIALISTA BRASILEIRO (PSB) (1987), SUPLENTE, MESA DIRETORA DA CAMARA DOS DEPUTADOS, ELEIÇÃO DA MESA DIRETORA.","Decisão da Presidência sobre a questão de ordem apresentada pelo Deputado Júlio Delgado a respeito da indicação, pelo Deputado Isnaldo Bulhões Jr, de membro do PSB para o cargo de Suplente da Mesa Diretora da Casa.","O SR. PRESIDENTE (Arthur Lira. Bloco/PP - AL) - Eu quero rapidamente responder à questão de ordem do Deputado Júlio Delgado.
Quanto à questão de ordem, Deputado Júlio Delgado, esclareço que lhe assiste razão. De fato, não houve, pela decisão da Mesa, a constituição de um bloco válido, o Bloco do MDB.
Contudo, V.Exa. sabe que houve um acordo de Líderes, superveniente, que autorizou - inclusive feito no Colégio de Líderes, que é a instância onde os acordos devem ser feitos - o Líder Deputado Isnaldo Bulhões a comunicar candidaturas à Mesa, ainda que isso naturalmente não preclua as prerrogativas dos Líderes partidários.
Então, baseado nesse princípio, e com as assimetrias que houve em vários partidos, as candidaturas serão postas sem nenhum nível de situação de prerrogativa na urna. As duas candidaturas do PSB serão homologadas na urna eletrônica, muito embora a questão de ordem de V.Exa. tenha razão.",160541,Abertura,,
2021-02-26T14:28,,,FALA DO PRESIDENTE OU NO EXERCÍCIO DA PRESIDÊNCIA,http://imagem.camara.leg.br/dc_20b.asp?largura=&altura=&tipoForm=diarios&selCodColecaoCsv=D&Datain=27%2F2%2F2021&txPagina=30&txSuplemento=&enviar=Pesquisar,,,"PEC 3/2021, PROPOSTA DE EMENDA À CONSTITUIÇÃO, IMUNIDADE PARLAMENTAR, TRAMITAÇÃO, ESCLARECIMENTO.","Esclarecimento ao Deputado Glauber Braga sobre o rito de tramitação da Proposta de Emenda à Constituição nº 3, de 2021, acerca da alteração dos arts. 14, 27, 53, 102 e 105 da Carta Magna, para resguardo de prerrogativas parlamentares.","O SR. PRESIDENTE (Arthur Lira. PP - AL) - Muito obrigado, Deputado Glauber. Antes de iniciar a orientação, eu queria só fazer uma pequena corrigenda na fala de V.Exa.: isso não nasceu da Mesa, nem nasceu da Presidência.
A regulamentação de um artigo - um só! - causou toda essa celeuma. Não tem impunidade, não tem blindagem, não tem nada. A imunidade parlamentar precisa ter limites quanto ao seu absolutismo de voto e voz.
V.Exa. fez o encaminhamento, e eu também fico feliz, por não ter visto críticas ao mérito, talvez à forma. Mas a forma também foi combinada com a maioria esmagadora dos Líderes desta Casa, senão a unanimidade, que, para a votação da semana passada a respeito da situação do Deputado Daniel Silveira, esta Casa, o Congresso Nacional teria a obrigação de fechar as lacunas legislativas para que isso não mais acontecesse. Nós vamos continuar no nosso ritmo, e, se a Casa decidir, Deputado Glauber, que o rito deverá ser o normal, que a matéria deverá ir para as Comissões, deverá passar o tempo que for, a Casa decidirá pelo seu Plenário
Nós tivemos votações ontem que variaram de 304 a 319 votos, sem contar com um voto do PT ou poucos votos. Tentamos o acordo em todas as horas e em todos os momentos. A única coisa que esta Casa não aceitará são os mesmos ataques que o Supremo recebeu e não termos o mesmo tratamento com relação a pessoas que expressam o ódio, pensamentos antidemocráticos e agressões físicas a Deputados, pelo direito de voto e de voz.
Um Deputado ser ameaçado, como está sendo, por ser signatário de uma PEC, um Deputado ser ameaçado de levar porrada no meio da rua, ou alguém vir com cassetetes para a frente da Câmara dos Deputados não é admissível.
Deputado Marcel van Hattem, eu darei o tempo que for preciso para que V.Exa. faça cobranças também do mesmo tanto, na mesma medida da punição que a Câmara deu ao Deputado Daniel Silveira, por exemplo, em relação ao jornalista do SBT, do qual eu nem quero citar o nome, que agrediu a todos nesta Casa por discutirem - não é nem por votarem - modificações e regulamentações de um regramento do art. 53.
Como orienta o PT?",160541,Ordem do Dia,,
