dataHoraInicio,dataHoraFim,uriEvento,tipoDiscurso,urlTexto,urlAudio,urlVideo,keywords,sumario,transcricao,id,titulo,dataHoraInicio,dataHoraFim
2021-09-15T14:44,,,BREVES COMUNICAÇÕES,http://imagem.camara.leg.br/dc_20b.asp?largura=&altura=&tipoForm=diarios&selCodColecaoCsv=D&Datain=16%2F9%2F2021&txPagina=&txSuplemento=&enviar=Pesquisar,,,"PL 1595/2019, PROJETO DE LEI ORDINARIA, COMBATE AO TERRORISMO, CONTRATERRORISMO, REPUDIO.
PEC 32/2020, PROPOSTA DE EMENDA À CONSTITUIÇÃO, REFORMA ADMINISTRATIVA (2020), CONTRARIO.","Repúdio ao Projeto de Lei nº 1.595, de 2019, de autoria do Deputado Vitor Hugo, sobre as ações contraterroristas e a alteração das Leis de nºs 10.257, de 2001, e 9.807, de 1999. Defesa de rejeição da Proposta de Emenda à Constituição nº 32, de 2020, relativa à reforma administrativa.","O SR. PAULÃO (PT - AL. Sem revisão do orador.) - Sr. Presidente, quero cumprimentá-lo e cumprimentar os pares.
Sr. Presidente, quero falar sobre o Projeto de Lei nº 1.595, de 2019. Esse PL, na realidade, foi resgatado; originalmente é um projeto do Deputado Jair Bolsonaro, hoje Presidente da República. O ex-Líder do Governo, o Deputado Vitor Hugo, de novo o coloca em pauta. Sob o manto da luta contra o terrorismo, na realidade Bolsonaro quer fazer sua polícia secreta. A polícia secreta do Bolsonaro... (Falha na transmissão.)
O SR. PRESIDENTE (Eduardo Bismarck. PDT - CE) - Deputado Paulão, eu vou lhe conceder mais um minuto, já que o sistema caiu, para garantir a sua palavra.
O SR. PAULÃO (PT - AL) - Eu agradeço-lhe, Sr. Presidente.
Foi recriado esse projeto, que tem como escopo a luta contra o terrorismo. Qual é a tradição de terrorismo no Brasil? Na realidade, as entidades de classe das polícias militares, das polícias civis, da Polícia Federal compreendem que será uma nova polícia secreta do Bolsonaro, para atingir a sociedade civil organizada. O que está em jogo é o Estado Democrático de Direito. Então, eu reflito com os meus colegas que esse projeto está tramitando em uma Comissão Especial, mas vai chegar depois ao Plenário, e precisamos ter a altivez, na defesa da nossa Constituição - a exemplo da altivez em relação a outros projetos que colidem com o Estado Democrático de Direito -, de colocá-lo no lugar correto: no lixo da história. É onde esse Projeto de Lei nº 1.595, de 2019, merece estar.
E o outro assunto foi destacado por companheiros que me antecederam: a tramitação da Proposta de Emenda à Constituição nº 32, de 2020, a PEC da reforma administrativa. O único intento que o Presidente Bolsonaro tem junto com o Ministro da Economia é colocar os servidores públicos como inimigos, fazendo o esvaziamento do papel do Estado no Brasil, o esvaziamento das políticas públicas, terceirizando o serviço público, para fazer a manobra que ele já realiza hoje. Só no campo militar, ele tem mais de 6 mil militares à sua disposição, contingente maior que o do período da ditadura militar.
Agora, o que é grave? É grave a cumplicidade do Presidente da Câmara, o Deputado Arthur Lira. Ele está sendo avalista desse projeto da PEC 32/20, e é fundamental que os movimentos sociais se organizem e se mobilizem, fazendo uma disputa nas redes sociais, mas também nas ruas, colocando que esta reforma da PEC 32/20 vai atingir o povo brasileiro e, principalmente, a população que mais precisa do Estado. Esse projeto é criminoso e - repito - tem o aval do Presidente da República, do Ministro da Economia e do Presidente da Câmara, o Deputado Arthur Lira, que está sendo cúmplice nesse processo.
Sr. Presidente, eu gostaria de solicitar a divulgação do meu discurso nos meios de comunicação da Casa.
Muito obrigado.",171617,Breves Comunicações,,
2021-09-16T10:40,,,BREVES COMUNICAÇÕES,http://imagem.camara.leg.br/dc_20b.asp?largura=&altura=&tipoForm=diarios&selCodColecaoCsv=D&Datain=17%2F9%2F2021&txPagina=&txSuplemento=&enviar=Pesquisar,,,"ANIVERSÁRIO DE EMANCIPAÇÃO POLÍTICA, ALAGOAS, HOMENAGEM, CRISE SOCIAL, VIOLENCIA CONTRA A MULHER, JOVEM, NEGROS.",Agradecimento à Presidenta em exercício dos trabalhos pela mensagem de aniversário encaminhada ao orador. Transcurso do 204º aniversário de emancipação político-administrativa do Estado de Alagoas. Contradições sociais e violência institucional reinantes no Estado. Prática de violência contra a mulher e a juventude negra alagoanas. Homenagem a lideranças e celebridades do Estado de Alagoas.,"O SR. PAULÃO (PT - AL. Sem revisão do orador.) - Bom dia, Sra. Presidenta.
Primeiramente quero agradecer a mensagem carinhosa que recebi no meu aniversário, ontem, dia 15. Também desejo muita saúde para você e sua família.
Sra. Presidente, hoje, 16 de setembro, completam-se 204 anos da emancipação política de Alagoas. Alagoas pertencia ao Estado de Pernambuco, e sua emancipação foi um grande acordo das elites, combinando inclusive com o Império, já que o Estado de Pernambuco era um Estado que tinha um debate clássico já republicano, contrariando a monarquia.
Foi essa parte da elite pernambucana, combinando com o Império, na época, que criou o Estado de Alagoas. Então, a nossa origem é uma origem, repito, como a maioria dos Estados, da elite. 
Trata-se de um Estado que V.Exa. e vários Parlamentares conhecem, um Estado principalmente de sol e mar, com um povo trabalhador, um povo cativante, mas, ao mesmo tempo, com contradições sociais enormes. 
Quem conhece principalmente Maceió sabe que aquela orla marítima do centro até o Bairro Jacarecica tem o maior IDH - Índice de Desenvolvimento Humano do Brasil. Em compensação, a sua periferia tem os menores índices do mundo. Então, temos uma pobreza imensa. 
Além disso, há índices que infelizmente ainda envergonham o Estado, como a violência contra a mulher, a violência contra juventude negra. Ao longo dos anos, está sendo um desafio superar o processo dessas ações. Além disso, há uma violência institucional muito forte, que é uma marca histórica em Alagoas. 
De qualquer forma, eu quero pensar na emancipação nas figuras de Zumbi dos Palmares e Dandara. Desses, sim, nós temos orgulho de falar. Quando se pensa em Alagoas, temos que pensar em uma grande cientista chamada Nise da Silveira; em um grande escritor, referência no mundo, Graciliano Ramos; em um dos maiores músicos do mundo, Hermeto Pascoal; em um grande compositor e ator, que acalanta o mundo, Djavan. Essas são figuras de quem temos um orgulho nessa caminhada, como os atores da Globo e o autor do nosso famoso dicionário, Aurélio Buarque de Holanda.
São nessas figuras que destacamos nos 204 anos de emancipação e principalmente a classe trabalhadora, aqueles que mais sofreram e construíram a riqueza desse Estado, que hoje é referência de turismo para o Brasil e para o mundo.
Sra. Presidente, gostaria, se possível, que meu pronunciamento fosse divulgado pelos meios de comunicação.
Muito obrigado.",171617,Breves Comunicações,,
2021-09-22T13:04,,,BREVES COMUNICAÇÕES,http://imagem.camara.leg.br/dc_20b.asp?largura=&altura=&tipoForm=diarios&selCodColecaoCsv=D&Datain=23%2F9%2F2021&txPagina=&txSuplemento=&enviar=Pesquisar,,,"OLHO D'ÁGUA DO CASADO (AL), ANIVERSÁRIO DE EMANCIPAÇÃO POLÍTICA, HOMENAGEM.
CONCESSÃO, TÍTULO DE CIDADÃO HONORÁRIO, OLHO D'ÁGUA DO CASADO (AL), PAULÃO, DEPUTADO FEDERAL, ORADOR, RENAN FILHO, GOVERNADOR, ALAGOAS, AGRADECIMENTO.
JAIR BOLSONARO, PRESIDENTE DA REPÚBLICA, COMITIVA, ORGANIZAÇÃO DAS NAÇÕES UNIDAS (ONU), AUMENTO, DESEMPREGO, INFLAÇÃO, CRÍTICA.","Comemoração do 59º aniversário de emancipação político-administrativa do Município de Olho d´Água do Casado, no Estado de Alagoas. Outorga do título de Cidadão Casadense ao orador e ao Governador Renan Filho. Vexame causado ao Brasil pela presença do Presidente Jair Bolsonaro e sua comitiva em Nova Iorque, Estados Unidos da América. Escalada do desemprego e da inflação no País.","O SR. PAULÃO (PT - AL. Sem revisão do orador.) - Sr. Presidente, queria cumprimentá-lo e cumprimentar os pares e, de forma especial, os internautas que nos assistem.
Ontem, dia 21 de setembro, eu tive a oportunidade de participar da comemoração dos 59 anos de emancipação política da cidade de Olho d'Água do Casado, que fica no Alto Sertão, às margens do cânion do São Francisco, e tem como Prefeito o Zé dos Santos, conhecido como Zé da Emater. Eu acompanho aquele Município alocando recursos. Ontem, a atividade foi muito importante e exitosa, tendo o anúncio de obras e novos investimentos, com a presença do Governador Renan Filho. Aquele Município tem a marca da agricultura familiar, que junto ao turismo faz uma integração importante. Então, quero registrar isso e, ao mesm o tempo, dizer que estou gratificado, porque recebi também o título de Cidadão Casadense, junto com o Governador Renan Filho. Isso aumenta a minha responsabilidade e o meu compromisso com aquele Município e com o povo daquela região.
Mas eu queria também destacar a situação da visita do Presidente à ONU. Que vergonha! Esse Presidente é um pária internacional. Ele não é levado a sério. A fotografia simbólica do Brasil é ele comendo pizza e levando puxão de orelha do Prefeito de Nova York, que disse que ele só entraria em algum restaurante se estivesse vacinado. Isso foi vergonhoso, assim como foi também o comportamento do filho dele, colega de Parlamento, Eduardo Bolsonaro, que comigo pertence à CREDN, a Comissão de Relações Exteriores e de Defesa Nacional. Outro pária. E, por último, veio a grande vergonha: o Ministro da Saúde com COVID. Vejam a simbologia que é o Ministro da Saúde com COVID! Vai ficar de quarentena por 14 dias nos Estados Unidos. Isso é um motivo que envergonha o Brasil.
Enquanto tivermos esses dirigentes, que são a marca da negação da ciência e da diplomacia, da falta de respeito ao processo internacional das relações multilaterais, infelizmente o Brasil terá uma dificuldade imensa para caminhar. E a marca nossa é uma inflação que corrói o poder de compra, com o desemprego de 15 milhões de brasileiros, atingindo a juventude.
Por tudo isso...
(Desligamento automático do microfone.)
O SR. PRESIDENTE (General Peternelli. PSL - SP) - Peço-lhe que conclua, Deputado.
O SR. PAULÃO (PT - AL) - Eu agradeço a V.Exa., Deputado General Peternelli, e peço, se possível, que divulgue nos meios de comunicação essa situação internacional.
Eu, que estou integrante da Comissão de Relações Exteriores e de Defesa Nacional, com muito orgulho, infelizmente fico envergonhado de ter um pária comandando o Brasil.",171617,Breves Comunicações,,
2021-09-22T17:12,,,DISCUSSÃO,http://imagem.camara.leg.br/dc_20b.asp?largura=&altura=&tipoForm=diarios&selCodColecaoCsv=D&Datain=23%2F9%2F2021&txPagina=41&txSuplemento=&enviar=Pesquisar,,,"DISCUSSÃO, PL 1100/2021, PROJETO DE LEI ORDINÁRIA, FAVORÁVEL, PARTIDO DOS TRABALHADORES (PT), EMENDA, DEFINIÇÃO, COMISSÃO, MINISTÉRIO DA SAÚDE, MINISTÉRIO DO TRABALHO E PREVIDÊNCIA SOCIAL, ANÁLISE, CONCESSÃO, ISENÇÃO TRIBUTÁRIA, IMPOSTO SOBRE A RENDA DA PESSOA FÍSICA (IRPF), PESSOA, SEQUELA, CORONAVÍRUS.","Discussão do Projeto de Lei nº 1.100, de 2021, sobre a alteração das Leis de nºs 7.713, de 1988, e 8.213, de 1991, com vista à isenção do Imposto de Renda sobre gastos com o tratamento e sequelas decorrentes da Covid-19, e à dispensa do período de carência para obtenção de benefícios previdenciários por incapacidade laboral provocada pela doença.","O SR. PAULÃO (PT - AL. Sem revisão do orador.) - Sr. Presidente, queria cumprimentar V.Exa. e todos os pares e dizer que esse projeto apresentado pelo Líder do PDT, o Deputado Wolney Queiroz, do Estado de Pernambuco, vizinho de Alagoas, é um projeto meritório, muito importante para uma realidade que atinge quase 600 mil pessoas no Brasil.
Eu queria só dialogar com o Relator. Estou aqui fazendo a minha narrativa de forma virtual.
O art. 4º que o Relator apresenta estabelece que será criada uma Comissão para analisar esses casos. Aí eu queria, Sr. Presidente, a sua ajuda e, principalmente, a ajuda do Relator para que não se deixasse em aberto o art. 4º, porque, deixando-se o art. 4º em aberto, esse controle poderá ser do Ministro da Economia, Paulo Guedes, que não terá interesse nenhum de efetivar esse projeto tão importante para a realidade que estamos atravessando. 
É por isso que o PT está apresentando uma emenda no momento exato para que essa atribuição não fique em aberto, mas, sim, seja do Ministério da Saúde, que já realiza isso e que é o Ministério afim, e do Ministério do Trabalho. Então, queríamos dialogar com o Relator sobre isso, que é referente ao art. 4º e ao art. 3º. 
A outra questão é mais a título de esclarecimento, não tem um valor de juízo definido. Quando ele estabelece a tipificação grave, que é fundamental para quem foi acometido da COVID-19 e tem aquela temporalidade acima de 15 dias, ele faz o recurso para se ter o auxílio, nesse período, pela Previdência. Nesse caso, essa zona cinzenta poderá prejudicar pessoas que foram acometidas da COVID, mas por tempo menor. Então, solicito esclarecimentos ao Relator.
Relator, eu acho muito perigoso deixar em aberto os arts. 3º e 4º. Eu acho que podíamos fechar um acordo para que a responsabilidade ficasse com o Ministério da Saúde e o Ministério do Trabalho. 
Quanto ao projeto, repito, o Deputado Wolney foi preciso. Estamos prestando, de uma forma prática, solidariedade...
(Desligamento automático do microfone.)",171617,Ordem do Dia,,
2021-09-22T17:48,,,PELA ORDEM,http://imagem.camara.leg.br/dc_20b.asp?largura=&altura=&tipoForm=diarios&selCodColecaoCsv=D&Datain=23%2F9%2F2021&txPagina=53&txSuplemento=&enviar=Pesquisar,,,"EMENDA, PARTIDO DOS TRABALHADORES (PT), DEFINIÇÃO, COMISSÃO, MINISTÉRIO DA SAÚDE, MINISTÉRIO DO TRABALHO E PREVIDÊNCIA SOCIAL, ANÁLISE, CONCESSÃO, ISENÇÃO TRIBUTÁRIA,  RELATOR, CONTRÁRIO,  PREJUÍZO, PL 1100/2021, PROJETO DE LEI ORDINARIA, ALTERAÇÃO, LEGISLAÇÃO TRIBUTÁRIA FEDERAL,  PESSOA, DIFICULDADE, SEQUELA, CORONAVÍRUS.
ORIENTAÇÃO DE BANCADA, SUBEMENDA SUBSTITUTIVA GLOBAL, PL 1100/2021, PROJETO DE LEI ORDINARIA, PARTIDO DOS TRABALHADORES (PT), VOTO FAVORÁVEL.","Não acolhimento de requerimento de destaque do PT pelo Relator do Projeto de Lei nº 1.100, de 2021, sobre a alteração das Leis de nºs 7.713, de 1988, e 8.213, de 1991, com vista à isenção do Imposto de Renda sobre gastos com o tratamento e sequelas decorrentes da Covid-19, e à dispensa do período de carência para obtenção de benefícios previdenciários por incapacidade laboral provocada pela doença. Orientação de bancada na votação da Subemenda Substitutiva Global, oferecida pelo Relator da Comissão de Seguridade Social e Família à proposição, ressalvados os destaques.","O SR. PAULÃO (PT - AL. Pela ordem. Sem revisão do orador.) - Sr. Presidente, agradeço a gentileza.
Gostaria de dizer que, na hora em que eu falei pelo PT defendendo o projeto, quando elogiei não só a iniciativa do Deputado Wolney Queiroz como também o relatório do Deputado André de Paula, o PT apresentou um destaque, o qual não foi considerado pelo Relator.
Eu entendo que o projeto ficou prejudicado. Hoje, já existe a Lei nº 8.213, de 1991, que define as atribuições para a questão previdenciária em relação às doenças. Então, não se trata de criar novas atribuições.
Eu fiquei preocupado e o PT também, porque fica em aberto a quem caberá definir as atribuições desse processo do direito em relação à questão dos sequelados pela COVID. O temor que nós temos é que isso fique a cargo do Ministro da Economia. Nós já temos uma lei que define que isso cabe aos Ministérios da Saúde e da Previdência, e infelizmente o Relator não acolheu o destaque do Partido dos Trabalhadores.
Mas votamos ""sim"".
Muito obrigado.",171617,Ordem do Dia,,
2021-09-28T16:20,,,BREVES COMUNICAÇÕES,http://imagem.camara.leg.br/dc_20b.asp?largura=&altura=&tipoForm=diarios&selCodColecaoCsv=D&Datain=29%2F9%2F2021&txPagina=&txSuplemento=&enviar=Pesquisar,,,"INFLAÇÃO, PREÇO, COMBUSTÍVEL, PETRÓLEO BRASILEIRO (PETROBRAS), REAJUSTE, ÓLEO DIESEL, ARTHUR LIRA, PRESIDENTE DA CÂMARA DOS DEPUTADOS, JAIR BOLSONARO, PRESIDENTE DA REPÚBLICA, CRÍTICA.
SENADO FEDERAL, SAÚDE PÚBLICA, PANDEMIA, CORONAVÍRUS, COMISSÃO PARLAMENTAR DE INQUÉRITO (CPI), CORRUPÇÃO, ORGANIZAÇÃO CRIMINOSA, GOVERNO FEDERAL, FAMÍLIA, JAIR BOLSONARO, PRESIDENTE DA REPÚBLICA.","Protesto contra o novo reajuste do óleo diesel. Contrariedade à política de preços praticada pela empresa Petróleo Brasileiro S/A - PETROBRAS. Necessidade de investigação de denúncias de corrupção contra o clã Bolsonaro, apresentadas à CPI da Covid. Reexame da gestão do Presidente Arthur Lira.","O SR. PAULÃO (PT - AL. Sem revisão do orador.) - Sr. Presidente, colegas Parlamentares, volto a esta Casa de forma presencial.
O assunto que eu queria destacar, Sr. Presidente, é mais um reajuste que o Governo Bolsonaro aplica contra a população brasileira: 9% no diesel! Isso tem consequência direta na logística do Brasil, porque a nossa malha é rodoviária; nós dependemos de caminhões.
O engraçado é que o Deputado Arthur Lira, Presidente desta Casa, meu colega de Alagoas, fica ironizando, Deputado Afonso, o Diretor da PETROBRAS, mas não toma medida concreta contra isso, porque o modelo que está implantado desde o Governo Temer até hoje é um modelo dolarizado: todo aumento do dólar tem consequência no preço dos combustíveis. Mas esse Presidente genocida terceiriza a responsabilidade para os Governadores.
Deputado Arthur Lira, é preciso ter estatura! Se V.Exa. não tiver altivez, vai fazer uma gestão pior do que a do Eduardo Cunha - hoje, em Alagoas, o Deputado Arthur Lira está com o Presidente Bolsonaro inaugurando residências que foram planejadas lá atrás pelo Governo Lula e pelo Governo Dilma.
Então, o reajuste do diesel é muito grave e vai ter consequência na inflação.
A outra questão, Sr. Presidente, é a declaração da médica na CPI da Saúde. 
Cada vez mais, Deputada Jandira, está comprovada a quadrilha montada pela Família Bolsonaro - a corrupção. Até quando os órgãos fiscalizadores, a exemplo da CGU, do Ministério Público e do Tribunal de Contas agirão com previdência? Porque quanto a esta Casa eu não tenho ilusão. Esta Casa está sendo omissa, não está tendo altivez histórica. Ao contrário do Senado, que está desempenhando um papel fundamental, Deputada Alice, esta Casa está rebaixada. E - repito o que eu disse - a gestão do Deputado Arthur Lira será pior do que a do Deputado Eduardo Cunha. Se continuar com essa gestão, o Deputado Arthur Lira vai para o lixo da história. 
Muito obrigado.",171617,Breves Comunicações,,
2021-09-29T15:40,,,BREVES COMUNICAÇÕES,http://imagem.camara.leg.br/dc_20b.asp?largura=&altura=&tipoForm=diarios&selCodColecaoCsv=D&Datain=30%2F9%2F2021&txPagina=&txSuplemento=&enviar=Pesquisar,,,"LUIZ INÁCIO LULA DA SILVA , EX-PRESIDENTE DA REPUBLICA,  FOME. 
REAJUSTE, PREÇO, COMBUSTÍVEL, DOLAR, PETRÓLEO BRASILEIRO (PETROBRAS), CRITICA.","Entrevista do ex-Presidente Luiz Inácio Lula da Silva sobre a reinclusão do Brasil no Mapa da Fome. Ocorrência de sucessivos reajustes nos preços de combustível, em face da política de dolarização adotada pela empresa Petróleo Brasileiro S/A - PETROBRAS. Elevação dos índices inflacionários. Alerta ao Presidente Arthur Lira sobre a importância de prioridade nas pautas sociais.","O SR. PAULÃO (PT - AL. Sem revisão do orador.) - Boa tarde, Presidente Gilberto Nascimento. Cumprimento todos os colegas Parlamentares. 
Sr. Presidente, queria dar destaque hoje a uma entrevista dada pelo ex-Presidente Lula. Na entrevista dele há uma frase com forte destaque: ""Quase 20 milhões de brasileiros e brasileiras voltaram a passar fome"". E sobre uma pauta como essa, principalmente do Presidente, o ex-Presidente Lula diz claramente, sem tergiversar: ""É preciso ter vergonha na cara"".
Quando o PT governou, principalmente com o Presidente Lula, retiramos 40 milhões de brasileiros e brasileiras que estavam na linha da miséria, conforme preconiza a principal organização internacional, que é a ONU. E esta Casa não discute, fica brincando de democracia. Lamento ver um Deputado que foi general e que percebemos não tem estatura para defender a soberania nacional, e fica discutindo com outros sobre o custo do combustível. 
Foi importante a postura do secretário que representa o CONFAZ: pode diminuir o ICMS do Estado, sim, mas com a reforma tributária e completa, porque esta não é a questão principal. O preço do combustível está assim porque está vinculado ao dólar, ao rentismo. E esse Deputado general não questiona a privatização da PETROBRAS, porque já não tem mais generais nacionalistas. Hoje, infelizmente, uma parte tem vinculação com o capital internacional. 
A inflação volta de forma galopante, com as pessoas disputando restos de carne, de ossos. O Brasil tem 30 milhões de cabeça de gado, e a população está disputando resto de osso. Por isso fiz uma fala ao Deputado Arthur Lira, quem eu conheço bem, que é de Alagoas, dizendo que ele tinha que colocar na pauta as prioridades do Brasil, as pautas sociais, a inflação galopante, a fome que volta ao Brasil, sob pena de entrar no lixo da história e ser um Presidente que vai ficar com uma marca pior do que a de Eduardo Cunha. 
O Senado está dando exemplo de como se discute o processo e o poder fiscalizador, e esta Casa está rebaixada, sem discutir as grandes pautas do Brasil.
Presidente, se possível, peço a divulgação do meu pronunciamento no programa A Voz do Brasil.
Obrigado.",171617,Breves Comunicações,,
2021-09-30T09:56,,,BREVES COMUNICAÇÕES,http://imagem.camara.leg.br/dc_20b.asp?largura=&altura=&tipoForm=diarios&selCodColecaoCsv=D&Datain=1%2F10%2F2021&txPagina=&txSuplemento=&enviar=Pesquisar,,,"PL 1374/2021, PROJETO DE LEI ORDINARIA, CRIAÇÃO, SUBVENÇÃO ECONÔMICA, FAMÍLIA DE BAIXA RENDA, COMPRA, GÁS LIQUEFEITO DE PETRÓLEO (GLP).
JAIR BOLSONARO, PRESIDENTE DA REPUBLICA, TEOTÔNIO VILELA (AL), SUSPENSÃO, OPERAÇÃO CARRO-PIPA, ABASTECIMENTO DE ÁGUA, SEMIÁRIDO.","Aplausos à Casa pela aprovação do Projeto de Lei nº 1.374, de 2021, sobre a instituição do auxílio gás social. Presença do Presidente Jair Bolsonaro no Município de Teotônio Vilela, Estado de Alagoas, para inauguração de conjunto residencial construído pelo Governo Dilma Rousseff. Suspensão pelo Exército brasileiro, diante do corte de recursos orçamentários, da Operação Carro-Pipa destinada ao abastecimento de água nas comunidades do semiárido nordestino.","O SR. PAULÃO (PT - AL. Sem revisão do orador.) - Sra. Presidente, queria cumprimentar V.Exa. e todo os pares presentes.
Sra. Presidente, a nossa Casa, mesmo não tendo uma postura altiva em relação principalmente ao Senado Federal, ontem deu boa demonstração em um projeto que tem sintonia com as agruras do povo brasileiro.
Trata-se de um projeto de autoria do Deputado Carlos Zarattini, do PT de São Paulo, que discute o preço do botijão de gás, que atinge todas as famílias, principalmente as mais carentes, que toda a bancada do PT subscreveu e do qual tive a honra também de ser coautor.
O projeto foi aprovado por ampla maioria, com exceção dos partidos integrantes da base do Governo diretamente. Mas esperamos que esse projeto prospere, e o Presidente Bolsonaro não vete. Nós estamos sabendo a situação de dificuldade por que passa a população mais pobre.
Outro assunto, Sra. Presidente.
O Presidente Bolsonaro, na terça-feira, foi para o Município de Teotônio Vilela inaugurar 200 casas, de um projeto da Presidente Dilma Rousseff. E S.Exa. faz um grande estardalhaço em relação a essa visita.
No entanto, nós recebemos uma notícia que choca a população de Alagoas e, eu não tenho dúvida, também a do Nordeste. O Exército, que é responsável pela distribuição dos carros-pipas, anuncia que a partir de outubro não terá dotação orçamentária para a distribuição dos carros-pipas no Semiárido do Nordeste. Isso é muito grave. O Presidente, quando foi inaugurar as casas, deveria ter anunciado a dotação orçamentária.
Alagoas é um Estado pequeno, com 102 Municípios. Em relação ao Semiárido, é um Estado que não tem tanta dificuldade. Mas a preocupação do Presidente da ANA e do Prefeito de Cacimbinhas, Hugo Vanderley, é de que estamos em pleno verão, e a questão hídrica tem um papel fundamental na vida.
E o Presidente Bolsonaro corta o orçamento dos carros-pipas no Nordeste? É tirar água, é atingir a vida do povo brasileiro.
É necessário que esta Casa tome providências, principalmente o Presidente da Casa, o Deputado Arthur Lira, colega meu alagoano, que foi com o Presidente. É necessário que ele faça essa defesa para o povo do Nordeste e, principalmente, para o Sertão de Alagoas. Esse é um apelo importante. Água é vida!
Por favor, divulgue o meu pronunciamento nos meios de comunicação, Sra. Presidente.
Muito obrigado.",171617,Breves Comunicações,,
